{
  "$schema": "https://json-schema.org/draft/2020-12/schema",
  "type": "object",
  "properties": {
    "version": {
      "type": "number",
      "const": 1
    },
    "scannerVersion": {
      "type": "integer",
      "exclusiveMinimum": 0,
      "maximum": 9007199254740991
    },
    "scanId": {
      "type": "string",
      "format": "uuid",
      "pattern": "^([0-9a-fA-F]{8}-[0-9a-fA-F]{4}-[1-8][0-9a-fA-F]{3}-[89abAB][0-9a-fA-F]{3}-[0-9a-fA-F]{12}|00000000-0000-0000-0000-000000000000|ffffffff-ffff-ffff-ffff-ffffffffffff)$"
    },
    "repository": {
      "type": "string",
      "minLength": 1
    },
    "sourceRevision": {
      "type": "string",
      "pattern": "^(?:[a-f0-9]{40}|[a-f0-9]{64})$"
    },
    "requestedRef": {
      "type": [
        "string",
        "null"
      ]
    },
    "preparedAt": {
      "type": "string",
      "format": "date-time",
      "pattern": "^(?:(?:\\d\\d[2468][048]|\\d\\d[13579][26]|\\d\\d0[48]|[02468][048]00|[13579][26]00)-02-29|\\d{4}-(?:(?:0[13578]|1[02])-(?:0[1-9]|[12]\\d|3[01])|(?:0[469]|11)-(?:0[1-9]|[12]\\d|30)|(?:02)-(?:0[1-9]|1\\d|2[0-8])))T(?:(?:[01]\\d|2[0-3]):[0-5]\\d:[0-5]\\d(?:\\.\\d+)?(?:Z))$"
    },
    "appliedAt": {
      "type": "string",
      "format": "date-time",
      "pattern": "^(?:(?:\\d\\d[2468][048]|\\d\\d[13579][26]|\\d\\d0[48]|[02468][048]00|[13579][26]00)-02-29|\\d{4}-(?:(?:0[13578]|1[02])-(?:0[1-9]|[12]\\d|3[01])|(?:0[469]|11)-(?:0[1-9]|[12]\\d|30)|(?:02)-(?:0[1-9]|1\\d|2[0-8])))T(?:(?:[01]\\d|2[0-3]):[0-5]\\d:[0-5]\\d(?:\\.\\d+)?(?:Z))$"
    },
    "catalogRevisionBefore": {
      "type": "string",
      "minLength": 1
    },
    "mode": {
      "type": "string",
      "enum": [
        "baseline",
        "investigation"
      ]
    },
    "scope": {
      "minItems": 1,
      "type": "array",
      "items": {
        "type": "object",
        "properties": {
          "componentId": {
            "type": "string",
            "minLength": 1
          },
          "sourcePath": {
            "type": "string",
            "minLength": 1
          },
          "areas": {
            "type": "array",
            "items": {
              "type": "string"
            }
          },
          "observationIds": {
            "type": "array",
            "items": {
              "type": "string"
            }
          }
        },
        "required": [
          "componentId",
          "sourcePath",
          "areas",
          "observationIds"
        ],
        "additionalProperties": false
      }
    },
    "exclusions": {
      "type": "object",
      "propertyNames": {
        "type": "string"
      },
      "additionalProperties": {
        "type": "integer",
        "minimum": 0,
        "maximum": 9007199254740991
      }
    },
    "budgets": {
      "type": "object",
      "propertyNames": {
        "type": "string"
      },
      "additionalProperties": {
        "type": "integer",
        "exclusiveMinimum": 0,
        "maximum": 9007199254740991
      }
    },
    "files": {
      "maxItems": 5000,
      "type": "array",
      "items": {
        "type": "object",
        "properties": {
          "path": {
            "type": "string",
            "minLength": 1,
            "maxLength": 4096
          },
          "digest": {
            "type": "string",
            "pattern": "^(?:[a-f0-9]{40}|[a-f0-9]{64})$"
          },
          "bytes": {
            "type": "integer",
            "minimum": 0,
            "maximum": 9007199254740991
          }
        },
        "required": [
          "path",
          "digest",
          "bytes"
        ],
        "additionalProperties": false
      }
    },
    "dependencyFingerprints": {
      "maxItems": 10000,
      "type": "array",
      "items": {
        "type": "object",
        "properties": {
          "path": {
            "type": "string",
            "minLength": 1,
            "maxLength": 4096
          },
          "digest": {
            "type": "string",
            "pattern": "^(?:[a-f0-9]{40}|[a-f0-9]{64})$"
          }
        },
        "required": [
          "path",
          "digest"
        ],
        "additionalProperties": false
      }
    },
    "omittedDependencyFingerprints": {
      "type": "integer",
      "minimum": 0,
      "maximum": 9007199254740991
    },
    "mappings": {
      "type": "array",
      "items": {
        "type": "object",
        "properties": {
          "entityId": {
            "type": "string",
            "minLength": 1
          },
          "path": {
            "type": "string",
            "minLength": 1,
            "maxLength": 4096
          },
          "revision": {
            "type": "string",
            "pattern": "^(?:[a-f0-9]{40}|[a-f0-9]{64})$"
          },
          "repository": {
            "type": "string"
          }
        },
        "required": [
          "entityId",
          "path",
          "revision"
        ],
        "additionalProperties": false
      }
    },
    "note": {
      "type": "string",
      "minLength": 1
    }
  },
  "required": [
    "version",
    "scannerVersion",
    "scanId",
    "repository",
    "sourceRevision",
    "requestedRef",
    "preparedAt",
    "appliedAt",
    "catalogRevisionBefore",
    "mode",
    "scope",
    "exclusions",
    "budgets",
    "files",
    "dependencyFingerprints",
    "omittedDependencyFingerprints",
    "mappings",
    "note"
  ],
  "additionalProperties": false
}
