{
  "version": 1,
  "scannerVersion": 7,
  "scanId": "3f1d0d3c-96ba-4f2a-9b8e-2f0a1c4d5e6f",
  "repository": "volvo-cars/gpe-pretax",
  "sourceRevision": "a1b2c3d4e5f60718293a4b5c6d7e8f90a1b2c3d4",
  "requestedRef": null,
  "preparedAt": "2026-01-01T00:00:00Z",
  "appliedAt": "2026-01-01T00:05:00Z",
  "catalogRevisionBefore": "none",
  "mode": "baseline",
  "scope": [
    {
      "componentId": "pretax-api--src-api",
      "sourcePath": "src/api",
      "areas": [
        "api"
      ],
      "observationIds": [
        "prices"
      ]
    }
  ],
  "exclusions": {},
  "budgets": {
    "files": 500
  },
  "files": [],
  "dependencyFingerprints": [],
  "omittedDependencyFingerprints": 0,
  "mappings": [
    {
      "entityId": "prices",
      "path": "src/api/prices.cs",
      "revision": "a1b2c3d4e5f60718293a4b5c6d7e8f90a1b2c3d4",
      "repository": "volvo-cars/gpe-pretax"
    }
  ],
  "note": "Baseline scan of the pretax API."
}
